{
  "antiCheatReference": "https://raw.githubusercontent.com/AreWeAntiCheatYet/AreWeAntiCheatYet/d876c32d21c69067406e3db44a12ae6633fb5fa7/games.json",
  "checkedAt": "2026-10-22T00:00:00Z",
  "market": "RO",
  "packageSource": "https://displaycatalog.mp.microsoft.com/v7.0/products",
  "products": {
    "9MSVBF0KZFVW": {
      "antiCheat": "unknown",
      "packageFormat": "MSIXVC",
      "pcPackageIdentified": true,
      "referencePlatforms": [],
      "technologyReferences": [],
      "title": "Blood Dungeon"
    },
    "9MSVPJCHHRPR": {
      "antiCheat": "unknown",
      "packageFormat": "unknown",
      "pcPackageIdentified": false,
      "referencePlatforms": [],
      "technologyReferences": [],
      "title": "Avowed Standard Edition"
    },
    "9MSVVM5NS9L6": {
      "antiCheat": "unknown",
      "packageFormat": "MSIXVC",
      "pcPackageIdentified": true,
      "referencePlatforms": [],
      "technologyReferences": [],
      "title": "DREDGE"
    },
    "9MT19Q3CRMQZ": {
      "antiCheat": "unknown",
      "packageFormat": "MSIXVC",
      "pcPackageIdentified": true,
      "referencePlatforms": [],
      "technologyReferences": [],
      "title": "Star Trucker"
    },
    "9MT5KSV3RCWD": {
      "antiCheat": "unknown",
      "packageFormat": "MSIXVC",
      "pcPackageIdentified": true,
      "referencePlatforms": [],
      "technologyReferences": [],
      "title": "Overthrown"
    },
    "9MT5NJ5W7B8Z": {
      "antiCheat": "none",
      "antiCheatEvidence": {
        "checkedAt": "2026-10-21",
        "method": "Complete path-signature inventory: not detected; not independently verified absence.",
        "mode": "unknown",
        "packageScan": {
          "complete": true,
          "fileCount": 541,
          "fileListSha256": "7fde98920dae4e030ab5e4cb5592d37f7d1d13f9541da5088078cebef70ddf25",
          "matches": {},
          "packageIdentity": {
            "storeId": "9MT5NJ5W7B8Z"
          },
          "result": "no-known-signature",
          "signatureSet": "anti-cheat-signatures-v1.json",
          "signatureVersion": 1,
          "symlinkCount": 0
        },
        "publicChecks": [
          {
            "checkedAt": "2026-10-21",
            "result": "No exact normalized title record with an anti-cheat technology in the pinned AWACY dataset.",
            "source": "https://raw.githubusercontent.com/AreWeAntiCheatYet/AreWeAntiCheatYet/d876c32d21c69067406e3db44a12ae6633fb5fa7/games.json",
            "sourceType": "awacy"
          },
          {
            "checkedAt": "2026-10-21",
            "result": "PCGamingWiki has a blank anti-cheat field and lists Denuvo under DRM/anti-tamper, not as an anti-cheat technology.",
            "source": "https://www.pcgamingwiki.com/wiki/Hogwarts_Legacy",
            "sourceType": "pcgamingwiki"
          },
          {
            "checkedAt": "2026-10-21",
            "result": "Official Xbox product page reviewed; no anti-cheat technology is described.",
            "source": "https://www.xbox.com/en-GB/games/store/hogwarts-legacy/9MT5NJ5W7B8Z",
            "sourceType": "publisher"
          }
        ],
        "source": "https://www.pcgamingwiki.com/wiki/Hogwarts_Legacy",
        "type": "package-scan"
      },
      "packageFormat": "MSIXVC",
      "packageFormatEvidence": {
        "checkedAt": "2026-10-21",
        "method": "Legacy catalogue observation; exact observed formats retained.",
        "observedFormats": [
          "MSIXVC",
          "XVC"
        ],
        "source": "https://displaycatalog.mp.microsoft.com/v7.0/products?bigIds=9MT5NJ5W7B8Z&market=RO&languages=en-US"
      },
      "pcPackageIdentified": true,
      "referencePlatforms": [],
      "supported01": true,
      "technologyReferences": [],
      "title": "Hogwarts Legacy"
    },
    "9MTD9ZS1G3CC": {
      "antiCheat": "unknown",
      "packageFormat": "unknown",
      "pcPackageIdentified": false,
      "referencePlatforms": [],
      "technologyReferences": [],
      "title": "Dead Space 3"
    },
    "9MTNPX4WLP10": {
      "antiCheat": "unknown",
      "packageFormat": "unknown",
      "pcPackageIdentified": false,
      "referencePlatforms": [],
      "technologyReferences": [],
      "title": "Plants vs. Zombies™ Game of the Year Edition"
    },
    "9MTP3NKHVWM6": {
      "antiCheat": "unknown",
      "packageFormat": "unknown",
      "pcPackageIdentified": false,
      "referencePlatforms": [],
      "technologyReferences": [],
      "title": "Mass Effect 2 (2010 Edition)"
    },
    "9MTVHJXXF3K9": {
      "antiCheat": "unknown",
      "packageFormat": "unknown",
      "pcPackageIdentified": false,
      "referencePlatforms": [],
      "technologyReferences": [],
      "title": "Plants vs. Zombies™ Garden Warfare 2: Deluxe Edition"
    },
    "9MTVJ3HHTQGS": {
      "antiCheat": "unknown",
      "packageFormat": "MSIXVC",
      "pcPackageIdentified": true,
      "referencePlatforms": [],
      "technologyReferences": [],
      "title": "Retro Classics"
    },
    "9MVF0PGV94F7": {
      "antiCheat": "unknown",
      "packageFormat": "MSIXVC",
      "pcPackageIdentified": true,
      "referencePlatforms": [],
      "technologyReferences": [],
      "title": "Dishonored®: Death of the Outsider™ (PC)"
    },
    "9MVN4ND41DD3": {
      "antiCheat": "unknown",
      "packageFormat": "MSIXVC",
      "pcPackageIdentified": true,
      "referencePlatforms": [],
      "technologyReferences": [],
      "title": "The Bard's Tale Trilogy"
    },
    "9MVPD3Z5N4QL": {
      "antiCheat": "unknown",
      "packageFormat": "unknown",
      "pcPackageIdentified": false,
      "referencePlatforms": [],
      "technologyReferences": [],
      "title": "Peggle®"
    },
    "9MVSRJWZBG9G": {
      "antiCheat": "unknown",
      "packageFormat": "MSIXVC",
      "pcPackageIdentified": true,
      "referencePlatforms": [],
      "technologyReferences": [],
      "title": "An Elder Scrolls Legend: Battlespire"
    },
    "9MVV32Z0JPCL": {
      "antiCheat": "unknown",
      "packageFormat": "unknown",
      "pcPackageIdentified": false,
      "referencePlatforms": [],
      "technologyReferences": [],
      "title": "FAR CRY 4"
    },
    "9MW15L8FRT9P": {
      "antiCheat": "unknown",
      "packageFormat": "MSIXVC",
      "pcPackageIdentified": true,
      "referencePlatforms": [],
      "technologyReferences": [],
      "title": "Escape the Backrooms"
    },
    "9MW4RJDRSF78": {
      "antiCheat": "unknown",
      "packageFormat": "MSIXVC",
      "pcPackageIdentified": true,
      "referencePlatforms": [],
      "technologyReferences": [],
      "title": "Dishonored 2"
    },
    "9MW53ZKZH168": {
      "antiCheat": "unknown",
      "packageFormat": "MSIXVC",
      "pcPackageIdentified": true,
      "referencePlatforms": [],
      "technologyReferences": [],
      "title": "Kiln"
    },
    "9MW715J1P29D": {
      "antiCheat": "NEAC Protect",
      "packageFormat": "MSIXVC",
      "pcPackageIdentified": true,
      "referencePlatforms": [
        "steam"
      ],
      "technologyReferences": [
        "NEAC Protect"
      ],
      "title": "FragPunk"
    },
    "9MW79BJVF3QX": {
      "antiCheat": "unknown",
      "packageFormat": "MSIXVC",
      "pcPackageIdentified": true,
      "referencePlatforms": [],
      "technologyReferences": [],
      "title": "RV There Yet?"
    },
    "9MW9469V91LM": {
      "antiCheat": "none",
      "antiCheatEvidence": {
        "checkedAt": "2026-10-21",
        "method": "Complete path-signature inventory: not detected; not independently verified absence.",
        "mode": "unknown",
        "packageScan": {
          "complete": true,
          "fileCount": 1796,
          "fileListSha256": "d77c68a2f7f547f4476db9193d21ad9e62cdac15536d3f2e63847f3104faf6b5",
          "matches": {},
          "packageIdentity": {
            "storeId": "9MW9469V91LM"
          },
          "result": "no-known-signature",
          "signatureSet": "anti-cheat-signatures-v1.json",
          "signatureVersion": 1,
          "symlinkCount": 0
        },
        "publicChecks": [
          {
            "checkedAt": "2026-10-21",
            "result": "No exact normalized title record with an anti-cheat technology in the pinned AWACY dataset.",
            "source": "https://raw.githubusercontent.com/AreWeAntiCheatYet/AreWeAntiCheatYet/d876c32d21c69067406e3db44a12ae6633fb5fa7/games.json",
            "sourceType": "awacy"
          },
          {
            "checkedAt": "2026-10-21",
            "result": "Reviewed page/search results; no anti-cheat technology record for this Windows PC title.",
            "source": "https://www.pcgamingwiki.com/wiki/Hollow_Knight",
            "sourceType": "pcgamingwiki"
          },
          {
            "checkedAt": "2026-10-21",
            "result": "Reviewed page/search results; no anti-cheat technology record for this Windows PC title.",
            "source": "https://store.steampowered.com/app/367520/Hollow_Knight/",
            "sourceType": "publisher"
          }
        ],
        "source": "https://www.pcgamingwiki.com/wiki/Hollow_Knight",
        "type": "package-scan"
      },
      "packageFormat": "MSIXVC",
      "packageFormatEvidence": {
        "checkedAt": "2026-10-21",
        "method": "Legacy catalogue observation; exact observed formats retained.",
        "observedFormats": [
          "MSIXVC",
          "XVC"
        ],
        "source": "https://displaycatalog.mp.microsoft.com/v7.0/products?bigIds=9MW9469V91LM&market=RO&languages=en-US"
      },
      "pcPackageIdentified": true,
      "referencePlatforms": [],
      "supported01": true,
      "technologyReferences": [],
      "title": "Hollow Knight: Voidheart Edition"
    },
    "9MWGGC7JH35B": {
      "antiCheat": "unknown",
      "packageFormat": "MSIXVC",
      "pcPackageIdentified": true,
      "referencePlatforms": [],
      "technologyReferences": [],
      "title": "Genesis Noir: Windows Edition"
    },